Title,Link
NemaLife chip: a micropillar-based microfluidic culture device optimized for aging studies in crawling C. elegans,https://www.ncbi.nlm.nih.gov/pmc/articles/PMC7530743/
Spaceflight affects neuronal morphology and alters transcellular degradation of neuronal debris in adult Caenorhabditis elegans,https://www.ncbi.nlm.nih.gov/pmc/articles/PMC7890410/
Microfluidics-integrated spaceflight hardware for measuring muscle strength of Caenorhabditis elegans on the International Space Station.,https://www.ncbi.nlm.nih.gov/pmc/articles/PMC9640571/
A Compact Imaging Platform for Conducting C. elegans Phenotypic Assays on Earth and in Spaceflight.,https://www.ncbi.nlm.nih.gov/pmc/articles/PMC9862956/
Mitochondrial sulfide promotes life span and health span through distinct mechanisms in developing versus adult treated Caenorhabditis elegans.,https://www.ncbi.nlm.nih.gov/pmc/articles/PMC10410709/
Bisphosphonates attenuate age-related muscle decline in Caenorhabditis elegans.,https://www.ncbi.nlm.nih.gov/pmc/articles/PMC10751425/
Spaceflight Induces Strength Decline in Caenorhabditis elegans,https://www.ncbi.nlm.nih.gov/pmc/articles/PMC10605753/
Metabolic model predictions enable targeted microbiome manipulation through precision prebiotics.,https://www.ncbi.nlm.nih.gov/pmc/articles/PMC10846184/
Transcriptomics analysis reveals molecular alterations underpinning spaceflight dermatology.,https://www.ncbi.nlm.nih.gov/pmc/articles/PMC11166967/
Identification and characterization of a skin microbiome on Caenorhabditis elegans suggests environmental microbes confer cuticle protection,https://www.ncbi.nlm.nih.gov/pmc/articles/PMC11302229/
Protein kinase 2 of the giant sarcomeric protein UNC-89 regulates mitochondrial morphology and function,https://www.ncbi.nlm.nih.gov/pmc/articles/PMC11487192/
New perspectives on viable microbial communities in low-biomass cleanroom environments,https://www.ncbi.nlm.nih.gov/pmc/articles/PMC3554398/
Microbial existence in controlled habitats and their resistance to space conditions,https://www.ncbi.nlm.nih.gov/pmc/articles/PMC10370681/
Microbiomes of the dust particles collected from the International Space Station and Spacecraft assembly facilities,https://www.ncbi.nlm.nih.gov/pmc/articles/PMC4624184/
"Draft genome sequences of two Aspergillus fumigatus strains, isolated from the International Space Station",https://www.ncbi.nlm.nih.gov/pmc/articles/PMC4945788/
Characterization of Aspergillus fumigatus isolates from air and surfaces of the International Space Station.,https://www.ncbi.nlm.nih.gov/pmc/articles/PMC9116463/
Draft genome sequences of biosafety level 2 opportunistic pathogens isolated from the environmental surfaces of the International Space Station.,https://www.ncbi.nlm.nih.gov/pmc/articles/PMC5201052/
Draft Genome Sequences of Several Fungal Strains Selected for Exposure to Microgravity at the International Space Station.,https://www.ncbi.nlm.nih.gov/pmc/articles/PMC5391430/
Human presence impacts fungal diversity of inflated lunar/Mars analog habitat.,https://www.ncbi.nlm.nih.gov/pmc/articles/PMC5504618/
Whole metagenome profiles of particulates collected from the International Space Station,https://www.ncbi.nlm.nih.gov/pmc/articles/PMC5580210/
Microbial Characteristics of ISS Environmental Surfaces,https://www.ncbi.nlm.nih.gov/pmc/articles/PMC8421509/
"Draft Genome Sequences from a Novel Clade of Bacillus cereus Sensu Lato Strains, Isolated from the International Space Station.",https://www.ncbi.nlm.nih.gov/pmc/articles/PMC5552977/
Draft Genome Sequences of Acinetobacter and Bacillus Strains Isolated from Spacecraft-Associated Surfaces,https://www.ncbi.nlm.nih.gov/pmc/articles/PMC5805884/
KatharoSeq enables high-throughput microbiome analysis from low-biomass samples,https://www.ncbi.nlm.nih.gov/pmc/articles/PMC5864415/
Draft genome sequence of a clinical isolate of Fusarium fujikuroi isolated from a male patient with acute myeloid leukemia.,https://www.ncbi.nlm.nih.gov/pmc/articles/PMC6013642/
"Draft Genome Sequence of Solibacillus kalamii, Isolated from an Air Filter Aboard the International Space Station",https://www.ncbi.nlm.nih.gov/pmc/articles/PMC5578834/
Detection of antimicrobial resistance genes associated with the International Space Station environmental surfaces,https://www.ncbi.nlm.nih.gov/pmc/articles/PMC9241228/
Draft genome sequences of two Fusarium oxysporum isolates cultured from infected Zinnia hybrida plants grown on the International Space Station.,https://www.ncbi.nlm.nih.gov/pmc/articles/PMC5958250/
Characterization of Aspergillus niger Isolated from the International Space Station,https://www.ncbi.nlm.nih.gov/pmc/articles/PMC7326050/
Multi-drug resistant Enterobacter bugandensis species isolated from the International Space Station and comparative genomic analyses with human pathogenic strains,https://www.ncbi.nlm.nih.gov/pmc/articles/PMC6251167/
Succession and persistence of microbial communities and antimicrobial resistance genes associated with International Space Station environmental surfaces,https://www.ncbi.nlm.nih.gov/pmc/articles/PMC6280456/
"International Space Station conditions alter genomics, proteomics, and metabolomics in Aspergillus nidulans.",https://www.ncbi.nlm.nih.gov/pmc/articles/PMC9098231/
Proteomic characterization of Aspergillus fumigatus isolated from air and surfaces of the International Space Station.,https://www.ncbi.nlm.nih.gov/pmc/articles/PMC9116463/
Genomic Characterization and Virulence Potential of Two Fusarium oxysporum Isolates Cultured from the International Space Station,https://www.ncbi.nlm.nih.gov/pmc/articles/PMC6426649/
Characterization of the total and viable bacterial and fungal communities associated with the International Space Station surfaces.,https://www.ncbi.nlm.nih.gov/pmc/articles/PMC6452512/
Proteomic and Metabolomic Characteristics of Extremophilic Fungi Under Simulated Mars Conditions.,https://www.ncbi.nlm.nih.gov/pmc/articles/PMC6529585/
MetaMiner: A Scalable Peptidogenomics Approach for Discovery of Ribosomal Peptide Natural Products with Blind Modifications from Microbial Communities,https://www.ncbi.nlm.nih.gov/pmc/articles/PMC6952069/
Draft Genome Sequences of Sphingomonas Species Associated with the International Space Station,https://www.ncbi.nlm.nih.gov/pmc/articles/PMC7303416/
Draft Genome Sequences of Tremellomycetes Strains Isolated from the International Space Station,https://www.ncbi.nlm.nih.gov/pmc/articles/PMC7317102/
Draft Genome Sequences of Rhodotorula mucilaginosa Strains Isolated from the International Space Station,https://www.ncbi.nlm.nih.gov/pmc/articles/PMC7393961/
Draft Genome Sequences of Enterobacteriales Strains Isolated from the International Space Station,https://www.ncbi.nlm.nih.gov/pmc/articles/PMC7484075/
Draft Genome Sequences of Lactobacillales Isolated from the International Space Station,https://www.ncbi.nlm.nih.gov/pmc/articles/PMC7516158/
Draft Genome Sequences of Klebsiella Species Isolated from the International Space Station,https://www.ncbi.nlm.nih.gov/pmc/articles/PMC7561690/
Draft Genome Sequences of Bacillaceae Strains Isolated from the International Space Station.,https://www.ncbi.nlm.nih.gov/pmc/articles/PMC7595942/
Assessing the risk of transfer of microorganisms at the International Space Station due to cargo delivery by commercial resupply vehicles,https://www.ncbi.nlm.nih.gov/pmc/articles/PMC7677455/
"Methylobacterium ajmalii sp. nov., isolated from the International Space Station",https://www.ncbi.nlm.nih.gov/pmc/articles/PMC8005752/
Draft Genome Sequences of Aspergillus and Penicillium Species Isolated from the International Space Station and Crew Resupply Vehicle Capsule,https://www.ncbi.nlm.nih.gov/pmc/articles/PMC8104057/
Advances in Space Microbiology,https://www.ncbi.nlm.nih.gov/pmc/articles/PMC12034939/
Effects of simulated microgravity on the proteome and secretome of the polyextremotolerant black fungus Knufia chersonesos.,https://www.ncbi.nlm.nih.gov/pmc/articles/PMC8012687/
Draft Genome Sequences of Various Bacterial Phyla Isolated from the International Space Station,https://www.ncbi.nlm.nih.gov/pmc/articles/PMC8086211/
Evaluating the lettuce metatranscriptome with MinION sequencing for future spaceflight food production applications,https://www.ncbi.nlm.nih.gov/pmc/articles/PMC8211661/
Investigation of Spaceflight Induced Changes to Astronaut Microbiomes,https://www.ncbi.nlm.nih.gov/pmc/articles/PMC11988970/
Genomic Characterization of Potential Plant Growth-Promoting Features of Sphingomonas Strains Isolated from the International Space Station,https://www.ncbi.nlm.nih.gov/pmc/articles/PMC8754149/
"Genomic Characterization of the Titan-like Cell Producing Naganishia tulchinskyi, the First Novel Eukaryote Isolated from the International Space Station",https://www.ncbi.nlm.nih.gov/pmc/articles/PMC8875396/
Metabolic modeling of the International Space Station microbiome reveals key microbial interactions.,https://www.ncbi.nlm.nih.gov/pmc/articles/PMC9258157/
"Microbial Burden Estimation of Food Items, Built Environments, and the International Space Station Using Film Media",https://www.ncbi.nlm.nih.gov/pmc/articles/PMC9503880/
Multidrug-resistant Acinetobacter pittii is adapting to and exhibiting potential succession aboard the International Space Station.,https://www.ncbi.nlm.nih.gov/pmc/articles/PMC9743659/
Characterization of metagenome-assembled genomes from the International Space Station.,https://www.ncbi.nlm.nih.gov/pmc/articles/PMC10233975/
Comparative genomic analysis of Cohnella hashimotonis sp. nov. isolated from the International Space Station,https://www.ncbi.nlm.nih.gov/pmc/articles/PMC10308117/
Genomic analysis reveals the presence of emerging pathogenic Klebsiella lineages aboard the International Space Station,https://www.ncbi.nlm.nih.gov/pmc/articles/PMC10715203/
"Phylogenomics, phenotypic, and functional traits of five novel (Earth-derived) bacterial species isolated from the International Space Station and their prevalence in metagenomes",https://www.ncbi.nlm.nih.gov/pmc/articles/PMC10628120/
"Genomic, functional, and metabolic enhancements in multidrug-resistant Enterobacter bugandensis facilitating its persistence and succession in the International Space Station",https://www.ncbi.nlm.nih.gov/pmc/articles/PMC10960378/
"Phylogenomics, phenotypic, and functional traits of five novel (Earth-derived) bacterial species isolated from the International Space Station and their prevalence in metagenomes",https://www.ncbi.nlm.nih.gov/pmc/articles/PMC10628120/
Adaptation to space conditions of novel bacterial species isolated from the International Space Station revealed by functional gene annotations and comparative genome analysis,https://www.ncbi.nlm.nih.gov/pmc/articles/PMC11451251/
Spatial regulation of a common precursor from two distinct genes generates metabolite diversity,https://www.ncbi.nlm.nih.gov/pmc/articles/PMC5523082/
Recent advances in the genome mining of Aspergillus secondary metabolites (covering 2012–2018).,https://www.ncbi.nlm.nih.gov/pmc/articles/PMC6590338/
Cortical thinning and structural bone changes in non-human primates after single-fraction whole-chest irradiation.,https://www.ncbi.nlm.nih.gov/pmc/articles/PMC6036641/
Knee and Hip Joint Cartilage Damage from Combined Spaceflight Hazards of Low-Dose Radiation Less than 1 Gy and Prolonged Hindlimb Unloading.,https://www.ncbi.nlm.nih.gov/pmc/articles/PMC6599637/
The individual and combined effects of spaceflight radiation and microgravity on biologic systems and functional outcomes,https://www.ncbi.nlm.nih.gov/pmc/articles/PMC8274610/
Spaceflight and hind limb unloading induces an arthritic phenotype in knee articular cartilage and menisci of rodents,https://www.ncbi.nlm.nih.gov/pmc/articles/PMC8131644/
αKlotho decreases after reduced weight-bearing from both spaceflight and hindlimb unloading,https://www.ncbi.nlm.nih.gov/pmc/articles/PMC9163032/
Prolonged exposure to particulate chromate inhibits RAD51 nuclear import mediator proteins.,https://www.ncbi.nlm.nih.gov/pmc/articles/PMC5568470/
"Transcriptomics, NF-κB Pathway, and Their Potential Spaceflight-Related Health Consequences.",https://www.ncbi.nlm.nih.gov/pmc/articles/PMC5485990/
Interplay of space radiation and microgravity in DNA damage and DNA damage response.,https://www.ncbi.nlm.nih.gov/pmc/articles/PMC5460239/
"Synergistic Effects of Weightlessness, Isoproterenol, and Radiation on DNA Damage Response and Cytokine Production in Immune Cells",https://www.ncbi.nlm.nih.gov/pmc/articles/PMC6275019/
Transcriptome and proteome responses in RNAlater preserved tissue of Arabidopsis thaliana.,https://www.ncbi.nlm.nih.gov/pmc/articles/PMC5397022/
Spaceflight induces novel regulatory responses in Arabidopsis seedling as revealed by combined proteomic and transcriptomic analyses.,https://www.ncbi.nlm.nih.gov/pmc/articles/PMC7251690/
Mitigation and use of biofilms in space for the benefit of human space exploration,https://www.ncbi.nlm.nih.gov/pmc/articles/PMC10284894/
Toward sustainable space exploration: A roadmap for harnessing the power of microorganisms.,https://www.ncbi.nlm.nih.gov/pmc/articles/PMC10030976/
Longitudinal characterization of multispecies microbial populations recovered from spaceflight potable water,https://www.ncbi.nlm.nih.gov/pmc/articles/PMC8421509/
Designing a Novel Monitoring Approach for the Effects of Space Travel on Astronauts’ Health,https://www.ncbi.nlm.nih.gov/pmc/articles/PMC9964234/
"Draft genome sequence of Sphingomonas paucimobilis strain Sph5, isolated from tap water filtration membrane",https://www.ncbi.nlm.nih.gov/pmc/articles/PMC10793275/
Overexpression of CupB5 activates alginate overproduction in Pseudomonas aeruginosa by a novel AlgW-dependent mechanism,https://www.ncbi.nlm.nih.gov/pmc/articles/PMC4116675/
Burn injury-associated MHCII(+) immune cell accumulation around lymphatic vessels of the mesentery and increased lymphatic endothelial permeability are blocked by doxycycline treatment.,https://www.ncbi.nlm.nih.gov/pmc/articles/PMC5810432/
CubeSats for microbiology and astrobiology research,https://www.ncbi.nlm.nih.gov/pmc/articles/PMC10261121/
In situ resource utilisation: The potential for space biomining,https://www.ncbi.nlm.nih.gov/pmc/articles/PMC8739323/
The smallest space miners: Principles of space biomining,https://www.ncbi.nlm.nih.gov/pmc/articles/PMC8739323/
"Simulated micro-, lunar, and Martian gravities on Earth—effects on Escherichia coli growth, phenotype, and sensitivity to antibiotics.",https://www.ncbi.nlm.nih.gov/pmc/articles/PMC9502502/
Biofilm formation of Pseudomonas aeruginosa in spaceflight is minimized on lubricant impregnated surfaces.,https://www.ncbi.nlm.nih.gov/pmc/articles/PMC10432549/
Competitive Growth Assay of Mutagenized Chlamydomonas reinhardtii Compatible With the International Space Station Veggie Plant Growth Chamber.,https://www.ncbi.nlm.nih.gov/pmc/articles/PMC7261848/
Spatial Characterization of Microbial Communities on Multi-Species Leafy Greens Grown Simultaneously in the Vegetable Production Systems on the International Space Station,https://www.ncbi.nlm.nih.gov/pmc/articles/PMC8537831/
Response of Arabidopsis thaliana and Mizuna mustard seeds to simulated space radiation exposures.,https://www.ncbi.nlm.nih.gov/pmc/articles/PMC8879990/
Editorial: Revisiting the limits of plant life - plant adaptations to extreme terrestrial environments relating to astrobiology and space biology.,https://www.ncbi.nlm.nih.gov/pmc/articles/PMC10472590/
Metagenomic interrogation of urban Superfund site reveals antimicrobial resistance reservoir and bioremediation potential.,https://www.ncbi.nlm.nih.gov/pmc/articles/PMC11999716/
"In situ monitoring of barrier function on-chip via automated, non-invasive luminescence sensing.",https://www.ncbi.nlm.nih.gov/pmc/articles/PMC11969330/
37-day microgravity exposure in 16-week female C57BL/6J mice is associated with bone loss specific to weight-bearing skeletal sites.,https://www.ncbi.nlm.nih.gov/pmc/articles/PMC11940681/
Effects of Space Flight on Inflammasome Activation in the Brain of Mice.,https://www.ncbi.nlm.nih.gov/pmc/articles/PMC11941215/
Immunization induces inflammation in the mouse heart during spaceflight.,https://www.ncbi.nlm.nih.gov/pmc/articles/PMC11892206/
Analyzing the relationship between gene expression and phenotype in space-flown mice using a causal inference machine learning ensemble.,https://www.ncbi.nlm.nih.gov/pmc/articles/PMC11748630/
Sex-specific cardiovascular adaptations to simulated microgravity in Sprague-Dawley rats,https://www.ncbi.nlm.nih.gov/pmc/articles/PMC11659408/
NASA open science data repository: Open science for life in space.,https://www.ncbi.nlm.nih.gov/pmc/articles/PMC11701653/
Artificial gravity attenuates the transcriptomic response to spaceflight in the optic nerve and retina,https://www.ncbi.nlm.nih.gov/pmc/articles/PMC11593819/
Effect of simulated cosmic radiation on cytomegalovirus reactivation and lytic replication.,https://www.ncbi.nlm.nih.gov/pmc/articles/PMC11477029/
Protein kinase 2 of the giant sarcomeric protein UNC-89 regulates mitochondrial morphology and function.,https://www.ncbi.nlm.nih.gov/pmc/articles/PMC11487192/
To boldly go where no microRNAs have gone before: Spaceflight impact on risk for small-for-gestational-age infants.,https://www.ncbi.nlm.nih.gov/pmc/articles/PMC11484870/
Adaptation to space conditions of novel bacterial species isolated from the International Space Station revealed by functional gene annotations and comparative genome analysis.,https://www.ncbi.nlm.nih.gov/pmc/articles/PMC11451251/
Celebrating 30 years of access to NASA space life sciences data.,https://www.ncbi.nlm.nih.gov/pmc/articles/PMC11403809/
Predicting how varying moisture conditions impact the microbiome of dust collected from the International Space Station.,https://www.ncbi.nlm.nih.gov/pmc/articles/PMC11386075/
Spaceflight alters host-gut microbiota interactions.,https://www.ncbi.nlm.nih.gov/pmc/articles/PMC11362537/
Discoveries from human stem cell research in space that are relevant to advancing cellular therapies on Earth.,https://www.ncbi.nlm.nih.gov/pmc/articles/PMC11339457/
Simulated microgravity impairs human NK [natural killer] cell cytotoxic activity against space radiation-relevant leukemic cells.,https://www.ncbi.nlm.nih.gov/pmc/articles/PMC11324864/
Simulated microgravity alters gene regulation linked to immunity and cardiovascular disease.,https://www.ncbi.nlm.nih.gov/pmc/articles/PMC11353732/
Spaceflight increases sarcoplasmic reticulum Ca2+ leak and this cannot be counteracted with BuOE treatment,https://www.ncbi.nlm.nih.gov/pmc/articles/PMC11271499/