Title,Link
Comparative genomic analysis of Cohnella hashimotonis sp. nov. isolated from the International Space Station.,https://www.ncbi.nlm.nih.gov/pmc/articles/PMC10308117/
Characterization of metagenome-assembled genomes from the International Space Station,https://www.ncbi.nlm.nih.gov/pmc/articles/PMC10233975/
Biocontrol in built environments to reduce pathogen exposure and infection risk.,https://www.ncbi.nlm.nih.gov/pmc/articles/PMC10848226/
Extracellular nucleotides elicit cytosolic free calcium oscillations in Arabidopsis.,https://www.ncbi.nlm.nih.gov/pmc/articles/PMC3329368/
"Calcium, mechanical signaling, and tip growth",https://www.ncbi.nlm.nih.gov/pmc/articles/PMC12008199/
Gravitropism and mechanical signaling in plants.,https://www.ncbi.nlm.nih.gov/pmc/articles/PMC12008199/
"Salt stress-induced Ca2+ waves are associated with rapid, long-distance root-to-shoot signaling in plants.",https://www.ncbi.nlm.nih.gov/pmc/articles/PMC4035928/
Gravitropic signaling in plants,https://www.ncbi.nlm.nih.gov/pmc/articles/PMC12008199/
Wortmannin-induced vacuole fusion enhances amyloplast dynamics in Arabidopsis zigzag1 hypocotyls.,https://www.ncbi.nlm.nih.gov/pmc/articles/PMC5181587/
A ROS-assisted calcium wave dependent on AtRBOHD and TPC1 propagates the systemic response to salt stress in Arabidopsis roots,https://www.ncbi.nlm.nih.gov/pmc/articles/PMC4936552/
"ROS, calcium and electric signals: Key mediators of rapid systemic signaling in plants",https://www.ncbi.nlm.nih.gov/pmc/articles/PMC7610290/
Real-time In Vivo Recording of Arabidopsis Calcium Signals During Insect Feeding Using a Fluorescent Biosensor,https://www.ncbi.nlm.nih.gov/pmc/articles/PMC5614317/
"Orchestrating rapid long-distance signaling in plants with Ca2+ , ROS, and electrical signals",https://www.ncbi.nlm.nih.gov/pmc/articles/PMC5677518/
"Glutamate triggers long-distance, calcium-based plant defense signaling.",https://www.ncbi.nlm.nih.gov/pmc/articles/PMC11850895/
Test of Arabidopsis Space Transcriptome: A discovery environment to explore multiple plant biology spaceflight experiments.,https://www.ncbi.nlm.nih.gov/pmc/articles/PMC7076552/
Tonoplast-localized Ca2+ pumps regulate Ca2+ signals during pattern-triggered immunity in Arabidopsis thaliana.,https://www.ncbi.nlm.nih.gov/pmc/articles/PMC7414185/
The fast and the furious: Rapid long-range signaling in plants.,https://www.ncbi.nlm.nih.gov/pmc/articles/PMC8133610/
Rad-Bio-App: A discovery environment for biologists to explore spaceflight-related radiation exposures,https://www.ncbi.nlm.nih.gov/pmc/articles/PMC8113475/
The vacuolar H+/Ca transporter CAX1 participates in submergence and anoxia stress responses.,https://www.ncbi.nlm.nih.gov/pmc/articles/PMC9706465/
Meta-analysis of the space flight and microgravity response of the Arabidopsis plant transcriptome,https://www.ncbi.nlm.nih.gov/pmc/articles/PMC10027818/
"Low-dose, ionizing radiation and age-related changes in skeletal microarchitecture",https://www.ncbi.nlm.nih.gov/pmc/articles/PMC3337602/
Ionizing Radiation Stimulates Expression of Pro-Osteoclastogenic Genes in Marrow and Skeletal Tissue,https://www.ncbi.nlm.nih.gov/pmc/articles/PMC4490751/
Preservation of Multiple Mammalian Tissues to Maximize Science Return from Ground Based and Spaceflight Experiments,https://www.ncbi.nlm.nih.gov/pmc/articles/PMC5132293/
Hindlimb Unloading: Rodent Analog for Microgravity,https://www.ncbi.nlm.nih.gov/pmc/articles/PMC11747068/
Redox Signaling and Its Impact on Skeletal and Vascular Responses to Spaceflight,https://www.ncbi.nlm.nih.gov/pmc/articles/PMC5666834/
Influence of social isolation during prolonged simulated weightlessness by hindlimb unloading,https://www.ncbi.nlm.nih.gov/pmc/articles/PMC6753329/
Validation of a new Rodent experimental System to investigate consequences of Long Duration Space Habitation,https://www.ncbi.nlm.nih.gov/pmc/articles/PMC7012842/
Skeletal tissue regulation by catalase over-expression in mitochondria,https://www.ncbi.nlm.nih.gov/pmc/articles/PMC4405755/
Overexpression of catalase in mitochondria mitigates changes in hippocampal cytokine expression following simulated microgravity and isolation.,https://www.ncbi.nlm.nih.gov/pmc/articles/PMC8260663/
An extensive allelic series of Drosophila kae1 mutants reveals diverse and tissue-specific requirements for t6A biogenesis,https://www.ncbi.nlm.nih.gov/pmc/articles/PMC4647464/
Novel Organelles with Elements of Bacterial and Eukaryotic Secretion Systems Weaponize Parasites of Drosophila,https://www.ncbi.nlm.nih.gov/pmc/articles/PMC5659752/
A combined computational strategy of sequence and structural analysis predicts the existence of a functional eicosanoid pathway in Drosophila melanogaster.,https://www.ncbi.nlm.nih.gov/pmc/articles/PMC6372189/
Immune suppressive extracellular vesicle proteins of Leptopilina heterotoma are encoded in the wasp genome.,https://www.ncbi.nlm.nih.gov/pmc/articles/PMC6945029/
Spaceflight and simulated microgravity conditions increase virulence of Serratia marcescens in the Drosophila melanogaster infection model.,https://www.ncbi.nlm.nih.gov/pmc/articles/PMC7000411/
A parasitoid wasp of Drosophila employs preemptive and reactive strategies to deplete its host's blood cells,https://www.ncbi.nlm.nih.gov/pmc/articles/PMC8191917/
In Silico Analysis of a Drosophila Parasitoid Venom Peptide Reveals Prevalence of the Cation–Polar–Cation Clip Motif in Knottin Proteins,https://www.ncbi.nlm.nih.gov/pmc/articles/PMC9865768/
Drosophila parasitoids go to space: Unexpected effects of spaceflight on hosts and their parasitoids.,https://www.ncbi.nlm.nih.gov/pmc/articles/PMC10797188/
Drosophila parasitoids go to space: Unexpected effects of spaceflight on hosts and their parasitoids,https://www.ncbi.nlm.nih.gov/pmc/articles/PMC10797188/
Simultaneous exposure of cultured human lymphoblastic cells to simulated microgravity and radiation increases chromosome aberrations,https://www.ncbi.nlm.nih.gov/pmc/articles/PMC7555395/
Genes required for survival in microgravity revealed by genome-wide yeast deletion collections cultured during spaceflight.,https://www.ncbi.nlm.nih.gov/pmc/articles/PMC4309212/
Physical Forces Modulate Oxidative Status and Stress Defense Meditated Metabolic Adaptation of Yeast Colonies: Spaceflight and Microgravity Simulations,https://www.ncbi.nlm.nih.gov/pmc/articles/PMC6560652/
Effects of space flight on mouse liver versus kidney: Gene pathway analyses.,https://www.ncbi.nlm.nih.gov/pmc/articles/PMC6321533/
Yeast in Space,https://www.ncbi.nlm.nih.gov/pmc/articles/PMC12040010/
Endocrine Effects of Space Flight,https://www.ncbi.nlm.nih.gov/pmc/articles/PMC11833055/
Role of shear stress on renal proximal tubular cells for nephrotoxicity assays,https://www.ncbi.nlm.nih.gov/pmc/articles/PMC9146534/
Bone hemodynamic responses to changes in external pressure.,https://www.ncbi.nlm.nih.gov/pmc/articles/PMC11492218/
Back pain in space and post-flight spine injury: Mechanisms and countermeasure development,https://www.ncbi.nlm.nih.gov/pmc/articles/PMC6339989/
Fifteen days of microgravity causes growth in calvaria of mice,https://www.ncbi.nlm.nih.gov/pmc/articles/PMC4110898/
Altered disc compression in children with idiopathic low back pain: an upright magnetic resonance imaging backpack study,https://www.ncbi.nlm.nih.gov/pmc/articles/PMC3947616/
Spaceflight-induced bone loss alters failure mode and reduces bending strength in murine spinal segments.,https://www.ncbi.nlm.nih.gov/pmc/articles/PMC5477841/
Spaceflight-associated vascular remodeling and gene expression in mouse calvaria.,https://www.ncbi.nlm.nih.gov/pmc/articles/PMC9139491/
"Exposure of Mycobacterium marinum to low-shear modeled microgravity: Effect on growth, the transcriptome and survival under stress.",https://www.ncbi.nlm.nih.gov/pmc/articles/PMC5515531/
Effects of mechanostimulation on gravitropism and signal persistence in flax roots.,https://www.ncbi.nlm.nih.gov/pmc/articles/PMC3258067/
Oxygen dependency of germinating Brassica seeds.,https://www.ncbi.nlm.nih.gov/pmc/articles/PMC10025027/
"Desiccation mitigates heat stress in the resurrection fern, Pleopeltis polypodioides",https://www.ncbi.nlm.nih.gov/pmc/articles/PMC7733933/
Transcription profile of auxin related genes during positively gravitropic hypocotyl curvature of Brassica rapa.,https://www.ncbi.nlm.nih.gov/pmc/articles/PMC9105288/
High-gradient magnetic fields and starch metabolism: Results from a space experiment.,https://www.ncbi.nlm.nih.gov/pmc/articles/PMC9617909/
Lipid rafts and plant gravisensitivity.,https://www.ncbi.nlm.nih.gov/pmc/articles/PMC9695138/
Expression and characterization of the bacterial mechanosensitive channel MscS in Xenopus laevis oocytes,https://www.ncbi.nlm.nih.gov/pmc/articles/PMC3503204/
United in Diversity: Mechanosensitive Ion Channels in Plants,https://www.ncbi.nlm.nih.gov/pmc/articles/PMC5896955/
Expressing and Characterizing Mechanosensitive Channels in Xenopus Oocytes,https://www.ncbi.nlm.nih.gov/pmc/articles/PMC4469364/
The ongoing search for the molecular basis of plant osmosensing,https://www.ncbi.nlm.nih.gov/pmc/articles/PMC4411250/
Plastid osmotic stress influences cell differentiation at the plant shoot apex.,https://www.ncbi.nlm.nih.gov/pmc/articles/PMC5047659/
Spaceflight-induced synaptic modifications within hair cells of the mammalian utricle.,https://www.ncbi.nlm.nih.gov/pmc/articles/PMC5454470/
Effects of angular frequency during clinorotation on mesenchymal stem cell morphology and migration,https://www.ncbi.nlm.nih.gov/pmc/articles/PMC5515506/
"The role of FGF-2 and BMP-2 in regulation of gene induction, cell proliferation and mineralization.",https://www.ncbi.nlm.nih.gov/pmc/articles/PMC3044105/
"Nutritional supplements, COX-2 and IGF-1 expression in men on active surveillance for prostate cancer.",https://www.ncbi.nlm.nih.gov/pmc/articles/PMC3002170/
To Infinity and Beyond! Human spaceflight and life science.,https://www.ncbi.nlm.nih.gov/pmc/articles/PMC6188462/
Hyperoxia inhibits T cell activation in mice,https://www.ncbi.nlm.nih.gov/pmc/articles/PMC11470607/
"Effects of gravitational mechanical unloading in endothelial cells: association between caveolins, inflammation and adhesion molecules",https://www.ncbi.nlm.nih.gov/pmc/articles/PMC3603133/
n-3 Polyunsaturated fatty acids supplementation in peripheral artery disease: the OMEGA-PAD trial,https://www.ncbi.nlm.nih.gov/pmc/articles/PMC6462350/
Molecular mechanisms underlying the enhanced functions of three-dimensional hepatocyte aggregates,https://www.ncbi.nlm.nih.gov/pmc/articles/PMC4012541/
Spaceflight alters expression of microRNA during T-cell activation,https://www.ncbi.nlm.nih.gov/pmc/articles/PMC4653058/
Spaceflight impairs antigen-specific tolerance induction in vivo and increases inflammatory cytokines.,https://www.ncbi.nlm.nih.gov/pmc/articles/PMC6137544/
"From cellular mechanotransduction to biologically inspired engineering: 2009 Pritzker Award Lecture, BMES Annual Meeting October 10, 2009.",https://www.ncbi.nlm.nih.gov/pmc/articles/PMC2913424/
Crewmember microbiome may influence microbial composition of ISS habitable surfaces,https://www.ncbi.nlm.nih.gov/pmc/articles/PMC7190111/
Sierra Nevada sweep: Metagenomic measurements of bioaerosols vertically distributed across the troposphere.,https://www.ncbi.nlm.nih.gov/pmc/articles/PMC7382458/
Draft Genome Sequences of Fungi Isolated from the International Space Station during the Microbial Tracking-2 Experiment,https://www.ncbi.nlm.nih.gov/pmc/articles/PMC8444978/
"Microbial tracking-2, a metagenomics analysis of bacteria and fungi onboard the International Space Station.",https://www.ncbi.nlm.nih.gov/pmc/articles/PMC9241228/
Detection of Target Genes for Drug Repurposing to Treat Skeletal Muscle Atrophy in Mice Flown in Spaceflight,https://www.ncbi.nlm.nih.gov/pmc/articles/PMC8953707/
Release of CD36-associated cell-free mitochondrial DNA and RNA as a hallmark of space environment response,https://www.ncbi.nlm.nih.gov/pmc/articles/PMC11166646/
Increasing the number of unloading/reambulation cycles does not adversely impac body composition and lumbar bone mineral density but reduces tissue sensitivity,https://www.ncbi.nlm.nih.gov/pmc/articles/PMC3747666/
Bone shaft bending strength index is unaffected by exercise and unloading in mice,https://www.ncbi.nlm.nih.gov/pmc/articles/PMC4337661/
Focal enhancement of the skeleton to exercise correlates to mesenchymal stem cell responsivity rather than peak external forces.,https://www.ncbi.nlm.nih.gov/pmc/articles/PMC4631774/
"Cytoskeletal configuration modulates mechanically induced changes in mesenchymal stem cell osteogenesis, morphology, and stiffness.",https://www.ncbi.nlm.nih.gov/pmc/articles/PMC5052530/
Genetic and tissue level muscle-bone interactions during unloading and reambulation.,https://www.ncbi.nlm.nih.gov/pmc/articles/PMC5114340/
Osteocyte apoptosis caused by hindlimb unloading is required to trigger osteocyte RANKL production and subsequent resorption of cortical and trabecular bone in mice femurs.,https://www.ncbi.nlm.nih.gov/pmc/articles/PMC5488280/
Differential Single Cell Responses of Embryonic Stem Cells Versus Embryoid Bodies to Gravity Mechanostimulation,https://www.ncbi.nlm.nih.gov/pmc/articles/PMC9293686/
Macrophages inhibit Aspergillus fumigatus germination and neutrophil-mediated fungal killing.,https://www.ncbi.nlm.nih.gov/pmc/articles/PMC6091969/
Contributions of spore secondary metabolites to UV-C protection and virulence vary in different Aspergillus fumigatus strains,https://www.ncbi.nlm.nih.gov/pmc/articles/PMC7029147/
Regulation of hemocytes in Drosophila requires dappled cytochrome b5.,https://www.ncbi.nlm.nih.gov/pmc/articles/PMC3092937/
A novel phototropic response to red light is revealed in microgravity.,https://www.ncbi.nlm.nih.gov/pmc/articles/PMC5748516/
Plant cell proliferation and growth are altered by microgravity conditions in spaceflight.,https://www.ncbi.nlm.nih.gov/pmc/articles/PMC9287483/
Phototropism of Arabidopsis thaliana in microgravity and fractional gravity on the International Space Station.,https://www.ncbi.nlm.nih.gov/pmc/articles/PMC5748516/
Light and gravity signals synergize in modulating plant development,https://www.ncbi.nlm.nih.gov/pmc/articles/PMC4211383/
A novel blue-light phototropic response is revealed in roots of Arabidopsis thaliana in microgravity.,https://www.ncbi.nlm.nih.gov/pmc/articles/PMC5748516/
Comparative transcriptomics indicate changes in cell wall organization and stress response in seedlings during spaceflight,https://www.ncbi.nlm.nih.gov/pmc/articles/PMC5821596/
RNAseq analysis of the response of Arabidopsis thaliana to fractional gravity under blue-light stimulation during spaceflight,https://www.ncbi.nlm.nih.gov/pmc/articles/PMC6889863/
Comparison of Microgravity Analogs to Spaceflight in Studies of Plant Growth and Development,https://www.ncbi.nlm.nih.gov/pmc/articles/PMC6908503/
The importance of Earth reference controls in spaceflight-omics research: Characterization of nucleolin mutants from the Seedling Growth experiments,https://www.ncbi.nlm.nih.gov/pmc/articles/PMC7607443/
Conducting plant experiments in space and on the Moon,https://www.ncbi.nlm.nih.gov/pmc/articles/PMC10764921/
Red light enhances plant adaptation to spaceflight and Mars g-levels.,https://www.ncbi.nlm.nih.gov/pmc/articles/PMC9605285/
EUK-134 ameliorates nNOSµ translocation and skeletal muscle fiber atrophy during short-term mechanical unloading.,https://www.ncbi.nlm.nih.gov/pmc/articles/PMC3962621/
MnSOD Overexpression Reduces Fibrosis and Pro-Apoptotic Signaling in the Aging Mouse Heart,https://www.ncbi.nlm.nih.gov/pmc/articles/PMC4462657/
Lifelong wheel running exercise and mild caloric restriction attenuate nuclear EndoG in the aging plantaris muscle.,https://www.ncbi.nlm.nih.gov/pmc/articles/PMC5026643/
Age-related alterations in the sarcolemmal environment are attenuated by lifelong caloric restriction and voluntary exercise.,https://www.ncbi.nlm.nih.gov/pmc/articles/PMC5026642/
"The impact of SRT2104 on skeletal muscle mitochondrial function, redox biology, and loss of muscle mass in hindlimb unloaded rats.",https://www.ncbi.nlm.nih.gov/pmc/articles/PMC10342025/
Bioreactor development for skeletal muscle hypertrophy and atrophy by manipulating uniaxial cyclic strain: Proof of concept.,https://www.ncbi.nlm.nih.gov/pmc/articles/PMC11167039/
Genomic and phenotypic characterization of Burkholderia isolates from the potable water system of the International Space Station,https://www.ncbi.nlm.nih.gov/pmc/articles/PMC10020673/
CAMDLES: CFD-DEM Simulation of Microbial Communities in Spaceflight and Artificial Microgravity,https://www.ncbi.nlm.nih.gov/pmc/articles/PMC9144607/
Hardware validation of the Advanced Plant Habitat on ISS: Canopy photosynthesis in reduced gravity.,https://www.ncbi.nlm.nih.gov/pmc/articles/PMC7314936/
Trimeric structure of (+)-pinoresinol-forming dirigent protein at 1.95 A resolution with three isolated active sites.,https://www.ncbi.nlm.nih.gov/pmc/articles/PMC4340379/
Reduced Arogenate Dehydratase Expression: Ramifications for Photosynthesis and Metabolism,https://www.ncbi.nlm.nih.gov/pmc/articles/PMC5933128/
New insights into lignification via network and multi-omics analyses of arogenate dehydratase knock-out mutants in Arabidopsis thaliana,https://www.ncbi.nlm.nih.gov/pmc/articles/PMC8185232/
Functional consequences of radiation-induced oxidative stress in cultured neural stem cells and the brain exposed to charged particle irradiation,https://www.ncbi.nlm.nih.gov/pmc/articles/PMC3936501/
Exploration of space to achieve scientific breakthroughs,https://www.ncbi.nlm.nih.gov/pmc/articles/PMC11998595/
Network Analysis of Gene Transcriptions of Arabidopsis thaliana in Spaceflight Microgravity.,https://www.ncbi.nlm.nih.gov/pmc/articles/PMC7996555/
Detection of Genes in Arabidopsis thaliana L. Responding to DNA Damage from Radiation and Other Stressors in Spaceflight,https://www.ncbi.nlm.nih.gov/pmc/articles/PMC8234954/
"The Effect of spaceflight on mouse olfactory bulb volume, neurogenesis, and cell death indicates the protective effect of novel environment.",https://www.ncbi.nlm.nih.gov/pmc/articles/PMC4152162/
"Effects of low-dose rate γ-irradiation combined with simulated microgravity on markers of oxidative stress, DNA methylation potential, and remodeling in the mouse heart",https://www.ncbi.nlm.nih.gov/pmc/articles/PMC5498037/
Characterization of mouse ocular response to a 35-day spaceflight mission: Evidence of blood-retinal barrier disruption and ocular adaptations.,https://www.ncbi.nlm.nih.gov/pmc/articles/PMC6547757/
Mice Exposed to Combined Chronic Low-Dose Irradiation and Modeled Microgravity Develop Long-Term Neurological Sequelae.,https://www.ncbi.nlm.nih.gov/pmc/articles/PMC6747492/
"Spaceflight influences gene expression, photoreceptor integrity, and oxidative stress-related damage in the murine retina.",https://www.ncbi.nlm.nih.gov/pmc/articles/PMC6746706/
Evaluating ocular response in the retina and optic nerve head after single and fractionated high-energy protons,https://www.ncbi.nlm.nih.gov/pmc/articles/PMC8400407/
Characterization of gene expression profiles in the mouse brain after 35 days of spaceflight mission.,https://www.ncbi.nlm.nih.gov/pmc/articles/PMC9365836/
A multi-omics longitudinal study of the murine retinal response to chronic low-dose irradiation and simulated microgravity.,https://www.ncbi.nlm.nih.gov/pmc/articles/PMC9547011/
Evidence of spaceflight-induced adverse effects on photoreceptors and retinal function in the mouse eye.,https://www.ncbi.nlm.nih.gov/pmc/articles/PMC10138634/
Effects of spaceflight on the brain,https://www.ncbi.nlm.nih.gov/pmc/articles/PMC12031868/
Routine omics collection is a golden opportunity for European human research in space and analog environments.,https://www.ncbi.nlm.nih.gov/pmc/articles/PMC9583032/
Spatial omics technologies at multimodal and single cell/subcellular level.,https://www.ncbi.nlm.nih.gov/pmc/articles/PMC9746133/
Genomic characterization and radiation tolerance of Naganishia kalamii sp. nov. and Cystobasidium onofrii sp. nov. from Mars 2020 mission assembly facilities.,https://www.ncbi.nlm.nih.gov/pmc/articles/PMC10422843/
"Genome and clonal hematopoiesis stability contrasts with immune, cfDNA, mitochondrial, and telomere length changes during short duration spaceflight",https://www.ncbi.nlm.nih.gov/pmc/articles/PMC11022651/
Inspiration4 data access through the NASA Open Science Data Repository,https://www.ncbi.nlm.nih.gov/pmc/articles/PMC11094041/
Molecular and physiologic changes in the SpaceX Inspiration4 civilian crew,https://www.ncbi.nlm.nih.gov/pmc/articles/PMC11357997/
Telomeric RNA (TERRA) increases in response to spaceflight and high-altitude climbing,https://www.ncbi.nlm.nih.gov/pmc/articles/PMC11167063/
Spatial multi-omics of human skin reveals KRAS and inflammatory responses to spaceflight,https://www.ncbi.nlm.nih.gov/pmc/articles/PMC11166909/
Longitudinal multi-omics analysis of host microbiome architecture and immune responses during short-term spaceflight,https://www.ncbi.nlm.nih.gov/pmc/articles/PMC11222149/
Spatiotemporal expression and control of haemoglobin in space,https://www.ncbi.nlm.nih.gov/pmc/articles/PMC11166948/
"Single-cell multi-ome and immune profiles of the Inspiration4 crew reveal conserved, cell-type, and sex-specific responses to spaceflight",https://www.ncbi.nlm.nih.gov/pmc/articles/PMC11166952/
Single-cell analysis identifies conserved features of immune dysfunction in simulated microgravity and spaceflight,https://www.ncbi.nlm.nih.gov/pmc/articles/PMC11166937/
The Space Omics and Medical Atlas (SOMA) and international astronaut biobank,https://www.ncbi.nlm.nih.gov/pmc/articles/PMC11357981/
"Secretome profiling reveals acute changes in oxidative stress, brain homeostasis, and coagulation following short-duration spaceflight",https://www.ncbi.nlm.nih.gov/pmc/articles/PMC11166969/
Astronaut omics and the impact of space on the human body at scale,https://www.ncbi.nlm.nih.gov/pmc/articles/PMC11166943/
Transcriptomics analysis reveals molecular alterations underpinning spaceflight dermatology.,https://www.ncbi.nlm.nih.gov/pmc/articles/PMC11166967/
"Cosmic kidney disease: an integrated pan-omic, physiological and morphological study into spaceflight-induced renal dysfunction",https://www.ncbi.nlm.nih.gov/pmc/articles/PMC11167060/
Spaceflight induces changes in gene expression profiles linked to insulin and estrogen,https://www.ncbi.nlm.nih.gov/pmc/articles/PMC11166981/
Protective alleles and precision healthcare in crewed spaceflight,https://www.ncbi.nlm.nih.gov/pmc/articles/PMC11263583/
To boldly go where no microRNAs have gone before: Spaceflight impact on risk for small-for-gestational-age infants,https://www.ncbi.nlm.nih.gov/pmc/articles/PMC11484870/
Growth chambers on the International Space Station for large plants,https://www.ncbi.nlm.nih.gov/pmc/articles/PMC10780891/
Microbiological and nutritional analysis of lettuce crops grown on the International Space Station,https://www.ncbi.nlm.nih.gov/pmc/articles/PMC7067979/
Natural variation in the expression of ORGANIC CATION TRANSPORTER 1 affects root length responses to cadaverine in Arabidopsis.,https://www.ncbi.nlm.nih.gov/pmc/articles/PMC4321547/
Auxin: Shape matters.,https://www.ncbi.nlm.nih.gov/pmc/articles/PMC6710492/
Gravity signaling in flowering plant roots,https://www.ncbi.nlm.nih.gov/pmc/articles/PMC12008199/
Cadaverine regulates biotin synthesis to modulate primary root growth in Arabidopsis,https://www.ncbi.nlm.nih.gov/pmc/articles/PMC8518694/
Low-speed clinorotation of Brachypodium distachyon and Arabidopsis thaliana seedlings triggers root tip curvatures that are reminiscent of gravitropism.,https://www.ncbi.nlm.nih.gov/pmc/articles/PMC9861679/
New device for high-throughput viability screening of flow biofilms,https://www.ncbi.nlm.nih.gov/pmc/articles/PMC2897429/
Sigma S-dependent antioxidant defense protects stationary-phase Escherichia coli against the bactericidal antibiotic gentamicin,https://www.ncbi.nlm.nih.gov/pmc/articles/PMC4187989/
Plasma membrane disruption (PMD) formation and repair in mechanosensitive tissues,https://www.ncbi.nlm.nih.gov/pmc/articles/PMC8217198/
Microgravity alters the expression of salivary proteins,https://www.ncbi.nlm.nih.gov/pmc/articles/PMC6981245/
Salivary Gland Protein Expression after Bion-M1 and Space Shuttle STS-135 Missions,https://www.ncbi.nlm.nih.gov/pmc/articles/PMC6981245/
Response of the mouse sublingual gland to spaceflight.,https://www.ncbi.nlm.nih.gov/pmc/articles/PMC6131065/
Effects of spaceflight on the mouse submandibular gland,https://www.ncbi.nlm.nih.gov/pmc/articles/PMC11233762/
"Reactivation of Latent Epstein-Barr Virus: A Comparison after Exposure to Gamma, Proton, Carbon, and Iron Radiation",https://www.ncbi.nlm.nih.gov/pmc/articles/PMC6213004/
The influence of spaceflight on the astronaut salivary microbiome and the search for a microbiome biomarker for viral reactivation,https://www.ncbi.nlm.nih.gov/pmc/articles/PMC7171750/
The cyclic nucleotide-gated channel CNGC14 regulates root gravitropism in Arabidopsis thaliana.,https://www.ncbi.nlm.nih.gov/pmc/articles/PMC10414970/
Telomere length assessments of muscle stem cells in rodent and human skeletal muscle sections,https://www.ncbi.nlm.nih.gov/pmc/articles/PMC8450295/
Persistent NF-κB activation in muscle stem cells induces proliferation-independent telomere shortening,https://www.ncbi.nlm.nih.gov/pmc/articles/PMC8183356/
Piezo1 regulates the regenerative capacity of skeletal muscles via orchestration of stem cell morphological states.,https://www.ncbi.nlm.nih.gov/pmc/articles/PMC8932657/
"Impacts of radiation exposure, hindlimb unloading, and recovery on murine skeletal muscle cell telomere length.",https://www.ncbi.nlm.nih.gov/pmc/articles/PMC10504369/
